[
  {
    "name": "PM",
    "description": "En PM (promemoria) för ett orienteringslopp är tävlingsinstruktionen — mer detaljerad information om tävlingen. Till exempel exakt var starten finns, parkeringsanvisningar och information om vätskekontroller. PM delas vanligtvis inte ut vid mindre tävlingar.",
    "tags": [],
    "related": [],
    "aliases": [
      "promemoria"
    ],
    "id": "PM"
  },
  {
    "name": "samlingsplats",
    "description": "Samlingsplatsen (även kallad arenan) är navet i ett orienteringslopp. Här hittar man mål, nedladdningsstation, funktionärer, resultatlistor, prisutdelning och ofta även dusch och förfriskningar. Starten är ofta belägen på en annan plats men är skyltad från samlingsplatsen.",
    "tags": [],
    "related": [],
    "aliases": [
      "arena"
    ],
    "id": "samlingsplass"
  },
  {
    "name": "budkavle",
    "description": "Budkavle (eller kavle) är det svenska ordet för stafett inom orientering. Ordet är av svenskt ursprung och är sedan länge etablerat i skandinavisk orienteringskultur. En stafett innebär att varje lagmedlem springer en sträcka och lämnar sedan över till näste löpare vid en växling.",
    "tags": [
      "stafett"
    ],
    "related": [],
    "aliases": [
      "kavle",
      "stafett"
    ],
    "id": "kavle"
  },
  {
    "name": "missa",
    "description": "Att missa (eller slå fel) innebär att man inte tar sig till en kontroll på ett bra sätt och därmed tappar tid. För en elitlöpare kan ett fel innebära 10–20 sekunders tidförlust, medan nybörjare kan tappa flera minuter på ett enda misstag.",
    "tags": [],
    "related": [],
    "aliases": [
      "slå fel",
      "fel"
    ],
    "id": "bomme"
  },
  {
    "name": "EMIT",
    "description": "EMIT är ett elektroniskt tidtagningssystem för orientering tillverkat av det norska företaget EMIT. Det är det dominerande systemet i norsk och finsk orientering. I Sverige och internationellt används <a href=\"/#sportident\">SPORTIdent</a> som standard. <i>Se <a href=\"/#tidtagning\">tidtagning</a></i>.",
    "tags": [
      "tidtagning"
    ],
    "related": [
      "SPORTIdent",
      "SFR",
      "emiTag"
    ],
    "aliases": [],
    "id": "EMIT"
  },
  {
    "name": "tidtagning",
    "description": "Elektronisk tidtagning i orientering bygger på att varje löpare har en personlig bricka registrerad på sig. När löparen kommer till en kontroll stämplar hen sin bricka i stämpelenheten, vilket registrerar besöket. I mål laddas brickan ner och man får ut sluttid samt mellantider mellan kontrollerna.",
    "tags": [
      "tidtagning"
    ],
    "related": [
      "EMIT",
      "SPORTIdent",
      "SFR"
    ],
    "aliases": [],
    "id": "tidtaking"
  },
  {
    "name": "gaffling",
    "description": "Gaffling används för att förhindra att tävlande hänger efter varandra (<a href=\"/#hnga\">se hänga</a>). Löpare i samma klass får banor som skiljer sig lite åt — de flesta kontroller är gemensamma, men vid vissa punkter besöker olika löpare kontroller på lite olika ställen innan de möts igen på nästa gemensamma kontroll.",
    "tags": [],
    "related": [],
    "aliases": [],
    "id": "gafling"
  },
  {
    "name": "kontrollbeskrivning",
    "description": "En kontrollbeskrivning är ett blad som medföljer kartan, ibland tryckt direkt på den. Den använder standardiserade IOF-symboler för att ange exakt vad varje kontroll är placerad vid — till exempel att kontroll 3 är på västra sidan av en stor sten.",
    "tags": [],
    "related": [],
    "aliases": [
      "kontrollbeskrivningslapp"
    ],
    "id": "postbeskrivelse"
  },
  {
    "name": "SPORTIdent",
    "description": "<a href=\"https://www.sportident.com/\">SPORTIdent</a> är det dominerande elektroniska tidtagningssystemet inom orientering i Sverige och internationellt. Den personliga brickan kallas SI-bricka. SPORTIdent är standard vid VM och används vid de allra flesta tävlingar i Sverige. <i>Se <a href=\"/#tidtagning\">tidtagning</a></i>.",
    "tags": [
      "tidtagning"
    ],
    "related": [
      "EMIT",
      "SFR",
      "SIAC"
    ],
    "aliases": [
      "SI"
    ],
    "id": "SPORTIdent"
  },
  {
    "name": "SFR",
    "description": "<a href=\"http://sfr-system.com/\">SFR</a> (Start Finish Result) är ett ryskt elektroniskt tidtagningssystem för orientering. Samma princip som SPORTIdent och EMIT.",
    "tags": [
      "tidtagning"
    ],
    "related": [
      "EMIT",
      "SPORTIdent"
    ],
    "aliases": [],
    "id": "SFR"
  },
  {
    "name": "Rankingløp",
    "description": "Rankingløp är ett informellt träningslopp som arrangeras veckovis av OSI Orientering och IL GeoForm i Oslo. Poäng samlas under säsongen till en totalrankning — därav namnet. Se mer på <a href=\"https://ilgeoform.no/rankinglop/\">Rankingløp-sidan</a>.",
    "tags": [],
    "related": [],
    "aliases": [],
    "id": "Rankingløp"
  },
  {
    "name": "Eventor",
    "description": "<a href=\"https://eventor.orientering.se\">Eventor</a> är en webbtjänst som ursprungligen utvecklades i Sverige av Svenska Orienteringsförbundet (SOFT). Tjänsten samlar tävlingskalender, anmälan och resultat för orienteringstävlingar och används i Sverige, Norge, Australien och för internationella tävlingar. Skapa ett konto för att anmäla dig till tävlingar online.",
    "tags": [],
    "related": [],
    "aliases": [],
    "id": "Eventor"
  },
  {
    "name": "karta",
    "description": "En orienteringskarta visar terrängen i förenklat format och är löparens viktigaste verktyg för att navigera mellan kontrollerna. Kartan innehåller många symboler: höjdkurvor visar höjdförhållanden, svarta prickar markerar stenar, blå ytor visar vatten och så vidare. Kartor trycks i olika <i><a href=\"/#skala\">skalor</a></i>, vanligen 1:7 500 eller 1:10 000 för tävlingsorientering och 1:15 000 för långdistans.",
    "tags": [],
    "related": [],
    "aliases": [],
    "id": "kart"
  },
  {
    "name": "skala",
    "description": "Kartskalan anger hur mycket verkligheten har skalats ned. En skala på 1:10 000 innebär att 1 cm på kartan motsvarar 10 000 cm (100 meter) i verkligheten. Turkarter använder ofta 1:50 000 och täcker ett stort område med begränsad detaljrikedom. Orienteringskartor har vanligtvis skalan 1:7 500 eller 1:10 000, och 1:15 000 för långdistans.",
    "tags": [],
    "related": [],
    "aliases": [
      "kartskala"
    ],
    "id": "målestokk"
  },
  {
    "name": "kompass",
    "description": "Ett kompass visar var norr (och söder, öster, väster) befinner sig. En orienterare använder kompassen för att hålla riktning mot nästa <a href=\"/#kontroll\">kontroll</a> eller för att lägga upp kartan — vrida den så att den stämmer med terrängen runt om.",
    "tags": [],
    "related": [],
    "aliases": [],
    "id": "kompass"
  },
  {
    "name": "kontroll",
    "description": "En orienteringskontroll (även kallad flagga eller post) består av en orange-vit kontrollflagga med en tillhörande stämplingsenhet som registrerar löparens besök. <i>Se <a href=\"/#tidtagning\">tidtagning</a></i>.",
    "tags": [],
    "related": [],
    "aliases": [
      "flagga",
      "post"
    ],
    "id": "orienteringspost"
  },
  {
    "name": "tumkompass",
    "description": "Ett tumkompass fästs på tummen och gör att man kan hålla karta och kompass som en enhet — den vanligaste kompasstypen bland orienterare. Traditionella plattakompassar förekommer också men är mer sällsynta i tävling. <i>Se <a href=\"/#kompass\">kompass</a></i>.",
    "tags": [],
    "related": [],
    "aliases": [],
    "id": "tommelkompass"
  },
  {
    "name": "A-nivå",
    "description": "A-nivå är den tekniskt mest krävande svårighetsgraden för en orienteringsbana. Alla orienteringstekniker behöver behärskas. <i>Se <a href=\"/#svrighetsgrad\">svårighetsgrad</a></i>.",
    "tags": [],
    "related": [
      "B-nivå",
      "C-nivå",
      "N-nivå"
    ],
    "aliases": [],
    "id": "A-nivå"
  },
  {
    "name": "B-nivå",
    "description": "B-nivå är den näst svåraste svårighetsgraden för en orienteringsbana. B-banor kräver kort finorientering in mot kontrollen och god förståelse för höjdkurvor. <i>Se <a href=\"/#svrighetsgrad\">svårighetsgrad</a></i>.",
    "tags": [],
    "related": [
      "A-nivå",
      "C-nivå",
      "N-nivå"
    ],
    "aliases": [],
    "id": "B-nivå"
  },
  {
    "name": "C-nivå",
    "description": "C-nivå är den näst enklaste svårighetsgraden för en orienteringsbana. C-banor följer i stort sett <a href=\"/#ledlinje\">ledlinjer</a>, men löparna förväntas ibland lämna ledlinjerna. Vägvalsmöjligheter kan förekomma. <i>Se <a href=\"/#svrighetsgrad\">svårighetsgrad</a></i>.",
    "tags": [],
    "related": [
      "A-nivå",
      "B-nivå",
      "N-nivå"
    ],
    "aliases": [],
    "id": "C-nivå"
  },
  {
    "name": "N-nivå",
    "description": "N-nivå är den enklaste svårighetsgraden för en orienteringsbana, utformad för nybörjare. N-banor följer sammanhängande <a href=\"/#ledlinje\">ledlinjer</a> som vägar, stigar, bäckar och stängsel, och alla kontroller kan ses från ledlinjen. <i>Se <a href=\"/#svrighetsgrad\">svårighetsgrad</a></i>.",
    "tags": [],
    "related": [
      "A-nivå",
      "B-nivå",
      "C-nivå"
    ],
    "aliases": [],
    "id": "N-nivå"
  },
  {
    "name": "svårighetsgrad",
    "description": "En orienteringsbana indelas i fyra svårighetsgrader: <a href=\"/#a-niv\">A</a>, <a href=\"/#b-niv\">B</a>, <a href=\"/#c-niv\">C</a> och <a href=\"/#n-niv\">N</a>, där A är svårast och N är nybörjarbana. Det skandinaviska graderingssystemet används i Sverige, Norge och Finland.",
    "tags": [],
    "related": [
      "A-nivå",
      "B-nivå",
      "C-nivå",
      "N-nivå"
    ],
    "aliases": [],
    "id": "vanskelighetsgrad"
  },
  {
    "name": "hänga",